{
  "schema_version": "ppg-graph/v0.1",
  "graph_id": "phase2-overclaim-material-graph",
  "title": "Phase 2 Overclaim Material Version Graph",
  "active_versions": {
    "evidence_inventory": "evidence_inventory_v1",
    "claim_boundary_map": "claim_boundary_map_v2",
    "reader_spine": "reader_spine_v1"
  },
  "nodes": [
    {
      "id": "owner_intent_v1",
      "node_type": "owner_intent",
      "label": "Owner Intent v1",
      "status": "committed",
      "version": "v1",
      "layer": 0,
      "summary": "Human-approved PPG runtime fixture scope and no-external route boundary."
    },
    {
      "id": "evidence_inventory_v1",
      "node_type": "material",
      "material_id": "evidence_inventory",
      "material_type": "EvidenceInventory",
      "label": "EvidenceInventory v1",
      "status": "committed",
      "version": "v1",
      "layer": 1,
      "artifact_path": "examples/materials/evidence_inventory.v1.yaml",
      "summary": "Known evidence package for the overclaim repair loop."
    },
    {
      "id": "claim_boundary_map_v1",
      "node_type": "material",
      "material_id": "claim_boundary_map",
      "material_type": "ClaimBoundaryMap",
      "label": "ClaimBoundaryMap v1",
      "status": "stale",
      "version": "v1",
      "layer": 2,
      "artifact_path": "examples/materials/claim_boundary_map.v1.yaml",
      "stale_reason": "Superseded by claim_boundary_map_v2 after overclaim review finding.",
      "summary": "Superseded claim boundary version preserved for provenance."
    },
    {
      "id": "reader_spine_v1",
      "node_type": "material",
      "material_id": "reader_spine",
      "material_type": "ReaderSpine",
      "label": "ReaderSpine v1",
      "status": "committed",
      "version": "v1",
      "layer": 2,
      "artifact_path": "examples/materials/reader_spine.v1.yaml",
      "summary": "Active reader-spine control material."
    },
    {
      "id": "intro_writing_packet_v1",
      "node_type": "transform_task",
      "task_id": "intro_writing_packet",
      "label": "WritingTaskPacket intro v1",
      "status": "validated",
      "version": "v1",
      "layer": 3,
      "artifact_path": "examples/packets/intro_writing_packet.v1.yaml",
      "summary": "Validated writing packet generated from claim boundary v1 and reader spine."
    },
    {
      "id": "intro_draft_v1",
      "node_type": "manuscript_artifact",
      "label": "Intro draft v1",
      "status": "candidate",
      "version": "v1",
      "layer": 4,
      "artifact_path": "examples/manuscript/intro.v1.md",
      "summary": "Candidate intro draft that overclaimed safety."
    },
    {
      "id": "reader_review_v1",
      "node_type": "validator",
      "label": "Reader and claim review v1",
      "status": "validated",
      "version": "v1",
      "layer": 5,
      "summary": "Review pass that produced the overclaim finding."
    },
    {
      "id": "finding_overclaim_v1",
      "node_type": "review_finding",
      "label": "Finding: overclaim v1",
      "status": "candidate",
      "version": "v1",
      "layer": 5,
      "failure_type": "claim_overreach",
      "primary_target": "claim_boundary_map_v1",
      "summary": "Draft states stronger guarantee than evidence supports."
    },
    {
      "id": "repair_claim_boundary_task_v1",
      "node_type": "backflow_task",
      "label": "Repair ClaimBoundaryMap task v1",
      "status": "validated",
      "version": "v1",
      "layer": 6,
      "summary": "Backflow task that creates claim_boundary_map_v2."
    },
    {
      "id": "claim_boundary_map_v2",
      "node_type": "material",
      "material_id": "claim_boundary_map",
      "material_type": "ClaimBoundaryMap",
      "label": "ClaimBoundaryMap v2",
      "status": "committed",
      "version": "v2",
      "layer": 2,
      "artifact_path": "examples/materials/claim_boundary_map.v2.yaml",
      "supersedes": "claim_boundary_map_v1",
      "summary": "Active claim boundary after local overclaim repair."
    },
    {
      "id": "claim_boundary_map_candidate_v3",
      "node_type": "material",
      "material_id": "claim_boundary_map",
      "material_type": "ClaimBoundaryMap",
      "label": "ClaimBoundaryMap v3 candidate",
      "status": "candidate",
      "version": "v3-candidate",
      "layer": 2,
      "artifact_path": "examples/materials/claim_boundary_map.v3-candidate.yaml",
      "candidate_for": "claim_boundary_map",
      "summary": "Candidate future revision; not active."
    },
    {
      "id": "claim_strength_validator_v1",
      "node_type": "validator",
      "label": "Claim strength validator v1",
      "status": "validated",
      "version": "v1",
      "layer": 7,
      "summary": "Checks claim strength does not exceed evidence."
    },
    {
      "id": "claim_boundary_map_v2_report",
      "node_type": "validation_report",
      "report_id": "claim_boundary_map_v2_report",
      "label": "ValidatorReport for ClaimBoundaryMap v2",
      "status": "validated",
      "version": "v1",
      "layer": 7,
      "artifact_path": "examples/validator-reports/claim_boundary_map.v2.json",
      "summary": "Validator report showing claim_boundary_map_v2 passed."
    }
  ],
  "edges": [
    {
      "id": "e0",
      "source": "owner_intent_v1",
      "target": "evidence_inventory_v1",
      "edge_type": "references",
      "dependency_strength": "provenance",
      "label": "owner evidence scope"
    },
    {
      "id": "e1",
      "source": "owner_intent_v1",
      "target": "claim_boundary_map_v1",
      "edge_type": "constrains",
      "dependency_strength": "hard"
    },
    {
      "id": "e2",
      "source": "evidence_inventory_v1",
      "target": "claim_boundary_map_v1",
      "edge_type": "consumes",
      "dependency_strength": "hard"
    },
    {
      "id": "e3",
      "source": "owner_intent_v1",
      "target": "reader_spine_v1",
      "edge_type": "constrains",
      "dependency_strength": "hard"
    },
    {
      "id": "e4",
      "source": "claim_boundary_map_v1",
      "target": "intro_writing_packet_v1",
      "edge_type": "consumes",
      "dependency_strength": "hard"
    },
    {
      "id": "e5",
      "source": "reader_spine_v1",
      "target": "intro_writing_packet_v1",
      "edge_type": "consumes",
      "dependency_strength": "hard"
    },
    {
      "id": "e6",
      "source": "intro_writing_packet_v1",
      "target": "intro_draft_v1",
      "edge_type": "produces",
      "dependency_strength": "hard"
    },
    {
      "id": "e7",
      "source": "reader_review_v1",
      "target": "intro_draft_v1",
      "edge_type": "validates",
      "dependency_strength": "soft"
    },
    {
      "id": "e8",
      "source": "reader_review_v1",
      "target": "finding_overclaim_v1",
      "edge_type": "reports",
      "dependency_strength": "provenance"
    },
    {
      "id": "e9",
      "source": "finding_overclaim_v1",
      "target": "claim_boundary_map_v1",
      "edge_type": "invalidates",
      "dependency_strength": "hard"
    },
    {
      "id": "e10",
      "source": "finding_overclaim_v1",
      "target": "repair_claim_boundary_task_v1",
      "edge_type": "produces",
      "dependency_strength": "hard"
    },
    {
      "id": "e11",
      "source": "repair_claim_boundary_task_v1",
      "target": "claim_boundary_map_v2",
      "edge_type": "produces",
      "dependency_strength": "hard"
    },
    {
      "id": "e12",
      "source": "claim_boundary_map_v2",
      "target": "claim_boundary_map_v1",
      "edge_type": "supersedes",
      "dependency_strength": "provenance",
      "label": "new version supersedes superseded version"
    },
    {
      "id": "e13",
      "source": "claim_strength_validator_v1",
      "target": "claim_boundary_map_v2",
      "edge_type": "validates",
      "dependency_strength": "hard"
    },
    {
      "id": "e14",
      "source": "claim_strength_validator_v1",
      "target": "claim_boundary_map_v2_report",
      "edge_type": "reports",
      "dependency_strength": "provenance"
    },
    {
      "id": "e15",
      "source": "claim_boundary_map_v2_report",
      "target": "claim_boundary_map_v2",
      "edge_type": "references",
      "dependency_strength": "provenance"
    },
    {
      "id": "e16",
      "source": "repair_claim_boundary_task_v1",
      "target": "claim_boundary_map_candidate_v3",
      "edge_type": "produces",
      "dependency_strength": "soft"
    }
  ]
}
